{
  "$schema": "../schemas/generator-registry.schema.json",
  "schemaVersion": 1,
  "snapshotDate": "2026-09-21",
  "policy": {
    "freeOnly": true,
    "paidPlanContentIncluded": false,
    "saasFreeTierIsNotOpenSource": true,
    "cloudTermsMustBeRecheckedBeforeProduction": true,
    "openSource3DModelGeneratorsOnly": true,
    "blocked3DAssetSources": ["https://www.polygen.app/", "generic low-poly and voxel asset catalogs"],
    "unknownOutputAction": "do-not-import",
    "redistribution": false
  },
  "generators": [
    {
      "id": "penpot",
      "name": "Penpot",
      "url": "https://github.com/penpot/penpot",
      "mode": "local-open-source",
      "categories": ["ui-design", "ux-prototyping", "design-systems", "vector"],
      "freeScope": "Open-source design and prototyping platform; self-hosting available",
      "licenseOrTerms": "MPL-2.0 for the application; shared design files may have separate licenses",
      "accountRequired": false,
      "outputPolicy": "User-created designs remain subject to their embedded asset licenses",
      "privacy": "Self-hostable",
      "inclusion": "catalog-link-only",
      "caveats": ["Check every community template and embedded asset separately"],
      "verificationUrls": ["https://github.com/penpot/penpot", "https://github.com/penpot/penpot-files"]
    },
    {
      "id": "grapesjs",
      "name": "GrapesJS",
      "url": "https://github.com/GrapesJS/grapesjs",
      "mode": "local-open-source",
      "categories": ["ui-builder", "page-builder", "email-builder", "components"],
      "freeScope": "Open-source visual web-builder framework",
      "licenseOrTerms": "BSD-3-Clause for the open-source core",
      "accountRequired": false,
      "outputPolicy": "Generated templates are controlled by the user's content and plugins",
      "privacy": "Self-hostable",
      "inclusion": "catalog-link-only",
      "caveats": ["GrapesJS Studio SDK is a separate commercial product", "Verify plugin licenses"],
      "verificationUrls": ["https://github.com/GrapesJS/grapesjs"]
    },
    {
      "id": "puck",
      "name": "Puck",
      "url": "https://github.com/puckeditor/puck",
      "mode": "local-open-source",
      "categories": ["ui-builder", "react", "page-builder", "components"],
      "freeScope": "Embeddable visual editor for React",
      "licenseOrTerms": "MIT",
      "accountRequired": false,
      "outputPolicy": "Application data and rendered output remain under project control",
      "privacy": "Self-hostable",
      "inclusion": "catalog-link-only",
      "caveats": ["Third-party fields, plugins and AI providers require separate review"],
      "verificationUrls": ["https://github.com/puckeditor/puck"]
    },
    {
      "id": "craftjs",
      "name": "Craft.js",
      "url": "https://github.com/prevwong/craft.js",
      "mode": "local-open-source",
      "categories": ["ui-builder", "react", "drag-and-drop", "components"],
      "freeScope": "Framework for building custom React page editors",
      "licenseOrTerms": "MIT",
      "accountRequired": false,
      "outputPolicy": "Output is defined by the host application",
      "privacy": "Self-hostable",
      "inclusion": "catalog-link-only",
      "caveats": ["It is a framework, not a finished editor"],
      "verificationUrls": ["https://github.com/prevwong/craft.js"]
    },
    {
      "id": "openui-wandb",
      "name": "OpenUI",
      "url": "https://github.com/wandb/openui",
      "mode": "free-software-external-model-required",
      "categories": ["ui-generation", "component-generation", "ai-to-code"],
      "freeScope": "Open-source UI generation application",
      "licenseOrTerms": "Apache-2.0 for the application",
      "accountRequired": false,
      "outputPolicy": "Depends on the selected model provider and generated dependencies",
      "privacy": "Self-hostable, but prompts may leave the device when a cloud model is selected",
      "inclusion": "catalog-link-only-conditional",
      "caveats": ["Model/API usage can be paid", "Verify the license of generated code and dependencies"],
      "verificationUrls": ["https://github.com/wandb/openui", "https://github.com/wandb/openui/blob/main/LICENSE"]
    },
    {
      "id": "onlook",
      "name": "Onlook",
      "url": "https://github.com/onlook-dev/onlook",
      "mode": "local-open-source",
      "categories": ["ui-design", "visual-code-editor", "react", "ai-to-code"],
      "freeScope": "Open-source visual editor that writes changes back to React code",
      "licenseOrTerms": "Apache-2.0 for the repository",
      "accountRequired": false,
      "outputPolicy": "Code remains in the user's project; AI provider terms may apply",
      "privacy": "Local workflow available; hosted successor has separate terms",
      "inclusion": "catalog-link-only",
      "caveats": ["The hosted early-access product is separate from the open-source repository"],
      "verificationUrls": ["https://github.com/onlook-dev/onlook", "https://github.com/onlook-dev/onlook/blob/main/LICENSE.md"]
    },
    {
      "id": "screenshot-to-code",
      "name": "screenshot-to-code",
      "url": "https://github.com/abi/screenshot-to-code",
      "mode": "free-software-external-model-required",
      "categories": ["screenshot-to-ui", "component-generation", "ai-to-code"],
      "freeScope": "Open-source screenshot, mockup and video-to-code application",
      "licenseOrTerms": "MIT for the application",
      "accountRequired": false,
      "outputPolicy": "Depends on the chosen AI provider and source screenshot rights",
      "privacy": "Self-hosted UI; inputs are sent to the configured model provider",
      "inclusion": "catalog-link-only-conditional",
      "caveats": ["Cloud model APIs may be paid", "Only transform screenshots you are authorized to reproduce"],
      "verificationUrls": ["https://github.com/abi/screenshot-to-code", "https://github.com/abi/screenshot-to-code/blob/main/LICENSE"]
    },
    {
      "id": "excalidraw",
      "name": "Excalidraw",
      "url": "https://github.com/excalidraw/excalidraw",
      "mode": "local-open-source",
      "categories": ["diagram", "wireframe", "whiteboard", "svg"],
      "freeScope": "Open-source whiteboard and wireframing editor",
      "licenseOrTerms": "MIT",
      "accountRequired": false,
      "outputPolicy": "User drawings are exportable as PNG, SVG and open JSON",
      "privacy": "Local/self-hosted use available",
      "inclusion": "catalog-link-only",
      "caveats": ["Library items and embedded images may have separate rights", "Hosted collaboration features have separate terms"],
      "verificationUrls": ["https://github.com/excalidraw/excalidraw"]
    },
    {
      "id": "mermaid",
      "name": "Mermaid",
      "url": "https://github.com/mermaid-js/mermaid",
      "mode": "local-open-source",
      "categories": ["diagram", "diagram-as-code", "documentation", "svg"],
      "freeScope": "Text-to-diagram library and editor ecosystem",
      "licenseOrTerms": "MIT",
      "accountRequired": false,
      "outputPolicy": "Diagrams are generated from user-authored definitions",
      "privacy": "Runs locally; hosted editor is optional",
      "inclusion": "catalog-link-only",
      "caveats": ["Third-party icon packs require separate review"],
      "verificationUrls": ["https://github.com/mermaid-js/mermaid"]
    },
    {
      "id": "drawio",
      "name": "draw.io / diagrams.net",
      "url": "https://github.com/jgraph/drawio",
      "mode": "local-open-source",
      "categories": ["diagram", "whiteboard", "flowchart", "architecture"],
      "freeScope": "Free diagram editor and desktop application",
      "licenseOrTerms": "Apache-2.0 for repository code; stencils and icons have additional terms",
      "accountRequired": false,
      "outputPolicy": "The project makes no copyright claim on user diagrams",
      "privacy": "Desktop and self-hosted options available",
      "inclusion": "catalog-link-only",
      "caveats": ["Review stencil and icon licenses", "Do not reuse trademarks or product branding"],
      "verificationUrls": ["https://github.com/jgraph/drawio", "https://github.com/jgraph/drawio-desktop"]
    },
    {
      "id": "carbon-code-images",
      "name": "Carbon",
      "url": "https://github.com/carbon-app/carbon",
      "mode": "local-open-source",
      "categories": ["code-image", "social-graphic", "svg", "png"],
      "freeScope": "Source-code image generator",
      "licenseOrTerms": "MIT",
      "accountRequired": false,
      "outputPolicy": "Exported image rights depend on the supplied code and selected fonts",
      "privacy": "Self-hostable and installable as a PWA",
      "inclusion": "catalog-link-only",
      "caveats": ["Do not expose secrets in code screenshots"],
      "verificationUrls": ["https://github.com/carbon-app/carbon"]
    },
    {
      "id": "css-doodle",
      "name": "css-doodle",
      "url": "https://github.com/css-doodle/css-doodle",
      "mode": "local-open-source",
      "categories": ["generative-art", "patterns", "backgrounds", "image", "video"],
      "freeScope": "Web component and CLI for generative CSS art, images and videos",
      "licenseOrTerms": "MIT",
      "accountRequired": false,
      "outputPolicy": "Generated compositions are controlled by their authored code and embedded assets",
      "privacy": "Local",
      "inclusion": "catalog-link-only",
      "caveats": ["Embedded fonts and images retain their own licenses"],
      "verificationUrls": ["https://github.com/css-doodle/css-doodle"]
    },
    {
      "id": "tabbied",
      "name": "Tabbied",
      "url": "https://github.com/tabbied-design/tabbied",
      "mode": "local-open-source",
      "categories": ["patterns", "backgrounds", "generative-art", "png"],
      "freeScope": "Pattern generator built with css-doodle",
      "licenseOrTerms": "MIT",
      "accountRequired": false,